source_path,file_name,detected_topic,primary_track,sensitivity,canonical_home,archive_home,action,reviewer,notes
/Users/melissastock/Downloads/Case Files-20260422T075812Z-3-001.zip,Case Files/Evidence & Files,raw evidence bundle,legal,legal-financial-restricted,Archiavellian-Archive evidence intake,Archiavellian-Archive/inbox/google-drive/2026-04/case-files,copy-to-archive,Melissa Stock,"71 files; includes DPD videos, discovery/evidence, witness communications, defense records, financial/property evidence workbooks. Extracted to controlled archive intake with hashes."
/Users/melissastock/Downloads/Case Files-20260422T075812Z-3-001.zip,Case Files/Pleadings and Legal Strategy,pleadings and legal strategy,legal,legal-financial-restricted,Divorce or matter-specific legal repo,Archiavellian-Archive/inbox/google-drive/2026-04/case-files,route-to-working-repo,Melissa Stock,"7 files; legal work product. Keep private and route only after matter assignment."
/Users/melissastock/Downloads/Case Files-20260422T075812Z-3-001.zip,Case Files/Legal Correspondence,legal correspondence,legal,legal-financial-restricted,Divorce or matter-specific legal repo,Archiavellian-Archive/inbox/google-drive/2026-04/case-files,route-to-working-repo,Melissa Stock,"3 files; correspondence/representation material. Treat as restricted legal material."
/Users/melissastock/Downloads/Case Files-20260422T075812Z-3-001.zip,Case Files/Defense Strategy & Internal Records,defense strategy and internal notes,legal,legal-financial-restricted,Divorce or matter-specific legal repo,Archiavellian-Archive/inbox/google-drive/2026-04/case-files,route-to-working-repo,Melissa Stock,"2 files; internal case notes/timeline. Legal track first."
/Users/melissastock/Downloads/Case Files-20260422T075812Z-3-001.zip,Case Files/Case Strategy & Analysis,case strategy and analysis,mixed,legal-financial-restricted,Legal track first; creator derivative only after review,Archiavellian-Archive/inbox/google-drive/2026-04/case-files,needs-review,Melissa Stock,"9 files; strategy exports and indexes may support both legal work and later narrative. No creator-track reuse until redaction review."
/Users/melissastock/Downloads/Case Files-20260422T075812Z-3-001.zip,Case Files/Civil Rights Lawsuit & Public Relations,public relations and notice materials,content-creator,ip-restricted,Producer / Archiavellian working repo after legal review,Archiavellian-Archive/reference/case-files-public-relations,route-to-working-repo,Melissa Stock,"2 files; potential content creator/public-facing track, but legal review required before publication or derivative use."
/Users/melissastock/Downloads/Case Files-20260422T075812Z-3-001.zip,Case Files/Documents/.DS_Store,system metadata,exclude,archive-sensitive,none,none,exclude,Melissa Stock,"1 system metadata file; do not archive or route."
